{
  "apiVersion": "product-profile/v1",
  "id": "profile:lesson-intended",
  "revision": "sha256:fa2961f4c86f472c70d175dc3671380223612f9b994b40818891a2acd411fa63",
  "mode": "intended",
  "product": {
    "id": "product:lesson-example",
    "name": "Lesson Example (synthetic fixture)",
    "version": {
      "id": "version:lesson-example-1",
      "label": "1.0.0",
      "build": "fixture-1"
    },
    "claimRefs": ["claim:product"]
  },
  "provenance": {
    "generatedAt": "2026-09-20T12:10:00Z",
    "producer": {
      "id": "fixture:profile-contract",
      "version": "1.0.0",
      "method": "projection"
    },
    "sources": [
      {
        "id": "source:product",
        "owner": "product-yaml",
        "locator": "product.yaml#requirements.lesson",
        "revision": "fixture-r1",
        "contentDigest": "sha256:46bc5fc28791c1fdc67340c1a13644cf2fb9195edf3ac4f413bfcdbb116e141d",
        "derivedFrom": []
      },
      {
        "id": "source:design",
        "owner": "design-md",
        "locator": "DESIGN.md#completion",
        "revision": "fixture-r1",
        "contentDigest": "sha256:d56f3b14bc5c1a9cd0eaa47e8b1129896606df2eb5dca1a97f42dab1e2556b6e",
        "derivedFrom": []
      },
      {
        "id": "source:render",
        "owner": "rendered-product-md",
        "locator": "PRODUCT.md#lesson",
        "revision": "fixture-r1",
        "contentDigest": "sha256:b56f2ffd8ed0d7d806a8c41cf813aa8054eb98ca234d36fa0ed9fcea2db51c04",
        "derivedFrom": ["source:product"]
      }
    ]
  },
  "elements": [
    {
      "id": "entity:lesson",
      "kind": "entity",
      "name": "Lesson",
      "claimRefs": ["claim:lesson-entity"]
    },
    {
      "id": "system:progression",
      "kind": "system",
      "name": "Progression",
      "claimRefs": ["claim:progression-system"]
    },
    {
      "id": "mechanic:completion",
      "kind": "mechanic",
      "name": "Completion rule",
      "claimRefs": ["claim:completion-mechanic"]
    },
    {
      "id": "state:learning",
      "kind": "state",
      "name": "Learning",
      "claimRefs": ["claim:learning-state"]
    },
    {
      "id": "surface:lesson",
      "kind": "surface",
      "name": "Lesson screen",
      "claimRefs": ["claim:lesson-surface"]
    },
    {
      "id": "transition:complete",
      "kind": "transition",
      "name": "Complete lesson",
      "claimRefs": ["claim:complete-transition"],
      "from": "state:learning",
      "to": "state:completed",
      "trigger": "event:completed"
    },
    {
      "id": "journey:learn",
      "kind": "journey",
      "name": "Learn a lesson",
      "claimRefs": ["claim:learn-journey"],
      "steps": ["transition:complete"]
    },
    {
      "id": "event:completed",
      "kind": "event",
      "name": "Completion event",
      "claimRefs": ["claim:completed-event"]
    },
    {
      "id": "effect:save-progress",
      "kind": "effect",
      "name": "Save progress",
      "claimRefs": ["claim:save-progress-effect"]
    },
    {
      "id": "visual-foundation:type",
      "kind": "visual-foundation",
      "name": "Type hierarchy",
      "claimRefs": ["claim:type-visual-foundation"]
    },
    {
      "id": "component:complete-button",
      "kind": "component",
      "name": "Completion control",
      "claimRefs": ["claim:complete-button-component"]
    },
    {
      "id": "navigation-pattern:back",
      "kind": "navigation-pattern",
      "name": "Back navigation",
      "claimRefs": ["claim:back-navigation-pattern"]
    },
    {
      "id": "motion-family:completion",
      "kind": "motion-family",
      "name": "Completion motion",
      "claimRefs": ["claim:completion-motion-family"]
    },
    {
      "id": "gesture-family:tap",
      "kind": "gesture-family",
      "name": "Tap gesture",
      "claimRefs": ["claim:tap-gesture-family"]
    },
    {
      "id": "feedback:success",
      "kind": "feedback",
      "name": "Success feedback",
      "claimRefs": ["claim:success-feedback"],
      "channels": ["visual", "audio", "haptic"]
    },
    {
      "id": "content-pattern:instruction",
      "kind": "content-pattern",
      "name": "Lesson instruction",
      "claimRefs": ["claim:instruction-content-pattern"]
    },
    {
      "id": "technical-characteristic:offline",
      "kind": "technical-characteristic",
      "name": "Offline behavior",
      "claimRefs": ["claim:offline-technical-characteristic"]
    },
    {
      "id": "state:completed",
      "kind": "state",
      "name": "Completed",
      "claimRefs": ["claim:completed-state"]
    }
  ],
  "relationships": [
    {
      "id": "relationship:completion-updates",
      "kind": "causes",
      "from": "event:completed",
      "to": "effect:save-progress",
      "claimRefs": ["claim:completion-updates"]
    },
    {
      "id": "relationship:progression-retains",
      "kind": "persists",
      "from": "system:progression",
      "to": "entity:lesson",
      "claimRefs": ["claim:progression-retains"]
    },
    {
      "id": "relationship:screen-control",
      "kind": "renders",
      "from": "surface:lesson",
      "to": "component:complete-button",
      "claimRefs": ["claim:screen-control"]
    },
    {
      "id": "relationship:completion-feedback",
      "kind": "emits",
      "from": "event:completed",
      "to": "feedback:success",
      "claimRefs": ["claim:completion-feedback"]
    },
    {
      "id": "relationship:back-surface",
      "kind": "navigates",
      "from": "navigation-pattern:back",
      "to": "surface:lesson",
      "claimRefs": ["claim:back-surface"]
    },
    {
      "id": "relationship:motion-state",
      "kind": "governs",
      "from": "motion-family:completion",
      "to": "state:completed",
      "claimRefs": ["claim:motion-state"]
    }
  ],
  "claims": [
    {
      "id": "claim:product",
      "subjectRef": "product:lesson-example",
      "statement": "A learner completes a lesson and views progress.",
      "status": "declared",
      "sourceRefs": ["source:product"],
      "evidenceRefs": []
    },
    {
      "id": "claim:lesson-entity",
      "subjectRef": "entity:lesson",
      "statement": "A lesson has an identifier and completion state.",
      "status": "declared",
      "sourceRefs": ["source:product"],
      "evidenceRefs": []
    },
    {
      "id": "claim:progression-system",
      "subjectRef": "system:progression",
      "statement": "The progression system retains completed lesson identifiers.",
      "status": "declared",
      "sourceRefs": ["source:product"],
      "evidenceRefs": []
    },
    {
      "id": "claim:completion-mechanic",
      "subjectRef": "mechanic:completion",
      "statement": "Completion adds a lesson to progress once.",
      "status": "declared",
      "sourceRefs": ["source:product"],
      "evidenceRefs": []
    },
    {
      "id": "claim:learning-state",
      "subjectRef": "state:learning",
      "statement": "The lesson is available to complete.",
      "status": "declared",
      "sourceRefs": ["source:product"],
      "evidenceRefs": []
    },
    {
      "id": "claim:lesson-surface",
      "subjectRef": "surface:lesson",
      "statement": "The lesson screen shows learning content and a completion control.",
      "status": "declared",
      "sourceRefs": ["source:product"],
      "evidenceRefs": []
    },
    {
      "id": "claim:complete-transition",
      "subjectRef": "transition:complete",
      "statement": "Completing a lesson moves learning to completed.",
      "status": "declared",
      "sourceRefs": ["source:product"],
      "evidenceRefs": []
    },
    {
      "id": "claim:learn-journey",
      "subjectRef": "journey:learn",
      "statement": "The learner completes the current lesson.",
      "status": "declared",
      "sourceRefs": ["source:product"],
      "evidenceRefs": []
    },
    {
      "id": "claim:completed-event",
      "subjectRef": "event:completed",
      "statement": "The completion control emits an event.",
      "status": "declared",
      "sourceRefs": ["source:product"],
      "evidenceRefs": []
    },
    {
      "id": "claim:save-progress-effect",
      "subjectRef": "effect:save-progress",
      "statement": "Progress remains after reopening the product.",
      "status": "declared",
      "sourceRefs": ["source:product"],
      "evidenceRefs": []
    },
    {
      "id": "claim:type-visual-foundation",
      "subjectRef": "visual-foundation:type",
      "statement": "Titles have a distinct text hierarchy.",
      "status": "declared",
      "sourceRefs": ["source:product"],
      "evidenceRefs": []
    },
    {
      "id": "claim:complete-button-component",
      "subjectRef": "component:complete-button",
      "statement": "A completion control appears on the lesson screen.",
      "status": "declared",
      "sourceRefs": ["source:product"],
      "evidenceRefs": []
    },
    {
      "id": "claim:back-navigation-pattern",
      "subjectRef": "navigation-pattern:back",
      "statement": "Back navigation returns to the lesson surface.",
      "status": "declared",
      "sourceRefs": ["source:product"],
      "evidenceRefs": []
    },
    {
      "id": "claim:completion-motion-family",
      "subjectRef": "motion-family:completion",
      "statement": "The completed state uses a visible transition.",
      "status": "declared",
      "sourceRefs": ["source:product"],
      "evidenceRefs": []
    },
    {
      "id": "claim:tap-gesture-family",
      "subjectRef": "gesture-family:tap",
      "statement": "A tap activates the completion control.",
      "status": "declared",
      "sourceRefs": ["source:product"],
      "evidenceRefs": []
    },
    {
      "id": "claim:success-feedback",
      "subjectRef": "feedback:success",
      "statement": "Completion produces visual, audio, and haptic feedback.",
      "status": "declared",
      "sourceRefs": ["source:product"],
      "evidenceRefs": []
    },
    {
      "id": "claim:instruction-content-pattern",